index,published,keyword,domain,language,valid,title,description,url,image,archive,content,quote,de,en,la,added
433914f617d62ffb9c6ce35f59b4f1c1,2026-02-04T14:33:26Z,'Klimaanpassung',hallespektrum.de,de,0.9,Sachsen-Anhalt gewährt Klima-III-Fördermittel für Dessau-Roßlau zur Hitzevorsorge und Klimaanpassung,"In Dessau-Roßlau hat Umweltminister Prof. Dr. Armin Willingmann zwei Klima-III-Förderbescheide im Gesamtumfang von 862.920 Euro an die Stadt überreicht. Die Mittel stammen aus dem Landesprogramm Klima III und zielen darauf ab, Hitzevorsorge auf Spielplätzen z…",https://hallespektrum.de/aktuelles/sachsen-anhalt-gewaehrt-klima-iii-foerdermittel-fuer-dessau-rosslau-zur-hitzevorsorge-und-klimaanpassung/475189/,https://hallespektrum.de/wp-content/uploads/2019/07/Gartenreich-Foto-ToK.jpg,,In Dessau-Roßlau hat Umweltminister Prof. Dr. Armin Willingmann zwei Klima-III-Förderbescheide im Gesamtumfang von 862.920 Euro an die Stadt überreicht. Die Mittel stammen aus dem Landesprogramm Klim… [+2512 chars],,"Sachsen-Anhalt gewährt Klima-III-Fördermittel für Dessau-Roßlau zur Hitzevorsorge und Klimaanpassung. In Dessau-Roßlau hat Umweltminister Prof. Dr. Armin Willingmann zwei Klima-III-Förderbescheide im Gesamtumfang von 862.920 Euro an die Stadt überreicht. Die Mittel stammen aus dem Landesprogramm Klima III und zielen darauf ab, Hitzevorsorge auf Spielplätzen z…","Saxony-Anhalt provides Climate III funding for Dessau-Roßlau for heat prevention and climate adaptation. In Dessau-Roßlau, Environment Minister Prof. Dr. Armin Willingmann presented two Climate III funding notices totaling 862,920 euros to the city. The funds come from the state program Climate III and are aimed at heat prevention in playgrounds.","Saxonia-Anhalt III sumptui pro Dessau-Roßlau sumptui climatis praebet pro calori praeventioni et adaptationis climatis. In Dessau-Roßlau, Ministerii Prof. Dr. Armin Willingmann duas Clima III funding notiones ad urbem summam pecuniae DCCCLXII,920 rettulit. Pecuniae ex programmatis Clima III publica veniunt et ad calorem praeventionis in playgrounds tenduntur.",2026-02-07 03:42:18+00:00
d3ccf17414ab9cb39575fbb7e547c489,2026-02-05T10:45:15Z,'Klimaneutralität',hallespektrum.de,de,0.9,Debatte um Einsatz des Sondervermögens: Grüne-Fraktion fordert Prioritätenprüfung in Halle,Der Einsatz der Mittel aus dem Sondervermögen des Bundes für Infrastruktur und Klimaneutralität sorgt in Halle für politische Diskussionen. Nach Angaben der Stadtratsfraktion BÜNDNIS 90/DIE GRÜNEN stehe die Stadt vor einem Investitionsbedarf von rund 600 Mill…,https://hallespektrum.de/aktuelles/debatte-um-einsatz-des-sondervermoegens-gruene-fraktion-fordert-prioritaetenpruefung-in-halle/475199/,https://hallespektrum.de/wp-content/uploads/2022/12/Strassenbahnen-Marktplatz.jpg,,Der Einsatz der Mittel aus dem Sondervermögen des Bundes für Infrastruktur und Klimaneutralität sorgt in Halle für politische Diskussionen. Nach Angaben der Stadtratsfraktion BÜNDNIS 90/DIE GRÜNEN st… [+2220 chars],,Debatte um Einsatz des Sondervermögens: Grüne-Fraktion fordert Prioritätenprüfung in Halle. Der Einsatz der Mittel aus dem Sondervermögen des Bundes für Infrastruktur und Klimaneutralität sorgt in Halle für politische Diskussionen. Nach Angaben der Stadtratsfraktion BÜNDNIS 90/DIE GRÜNEN stehe die Stadt vor einem Investitionsbedarf von rund 600 Mill…,"Debate about the use of the special fund: Green parliamentary group calls for a review of priorities in Halle. The use of funds from the federal government's special fund for infrastructure and climate neutrality is causing political discussions in Halle. According to the city council faction ALLIANCE 90/THE GREENS, the city faces an investment requirement of around 600 million...","Disceptatio de usu fisci specialis: Coetus parlamentarius viridis in Halle recognoscendi postulat. Usus pecuniarum ex speciali fisco imperii foederati pro infrastructura et neutralitate climatis in Halle disceptationes politicas causat. Iuxta factionem consilii urbani FOEDUS XC/VIRIDUM, urbs postulatum obsidionis circa DC decies centena milia respicit.",2026-02-07 03:42:18+00:00
e16ddb9a1c653dae1716fe01ea3a14d8,2026-02-03T19:39:50Z,'Temperaturrekord',www.n-tv.de,de,0.9,Negativrekord in der Karibik: Kuba erlebt erstmals null Grad,"Bei Kuba denkt man an tropische Wärme, Palmen und viel Sonne. Doch derzeit erlebt die Insel einen Kälteschock - zumindest für karibische Verhältnisse. Eine Wetterstation meldet einen negativen Temperaturrekord.",https://www.n-tv.de/panorama/Kuba-erlebt-erstmals-null-Grad-id30321099.html,https://www.n-tv.de/img/30321071/1770149707/Img_16_9/1200/Huge-waves-break-over-Havana-s-light-tower-in-Havana-Cuba-February-1-2026.jpg,http://web.archive.org/web/20260203205506/https://www.n-tv.de/panorama/Kuba-erlebt-erstmals-null-Grad-id30321099.html,"Negativrekord in der KaribikKuba erlebt erstmals null Grad
Die Hauptstadt Havanna bleibt vom Frost verschont. (Foto: REUTERS)
Bei Kuba denkt man an tropische Wärme, Palmen und viel Sonne. Doch derz… [+2123 chars]",,"Negativrekord in der Karibik: Kuba erlebt erstmals null Grad. Bei Kuba denkt man an tropische Wärme, Palmen und viel Sonne. Doch derzeit erlebt die Insel einen Kälteschock - zumindest für karibische Verhältnisse. Eine Wetterstation meldet einen negativen Temperaturrekord.","Negative record in the Caribbean: Cuba experiences zero degrees for the first time. When you think of Cuba, you think of tropical warmth, palm trees and lots of sun. But the island is currently experiencing a cold shock - at least by Caribbean standards. A weather station reports a negative temperature record.","Negative record in Caribbean: Cuba nullas gradus primum patitur. Cum Cubam cogitas, cogitas tropicum calorem, palmas et multas solem. Sed insula nunc frigidum - saltem per signa Caribbean experitur. Statio tempestatis recordum temperatus negativum refert.",2026-02-07 19:02:06+00:00
0d4ade6d5d37731577c9d34487651c06,2026-02-06T09:25:37Z,'Hitzetage',www.diepresse.com,de,0.9,Lebt Prinzessin Diana noch? Und was macht ein Wal in der Themse? [premium],"Es gibt eine neue Tendenz zum freundlichen Erzählen, und Oisín McKenna ist einer ­ihrer schillerndsten Vertreter. In „Hitzetage“ möchte man alle Figuren am liebsten umarmen.",https://www.diepresse.com/20550792/lebt-prinzessin-diana-noch-und-was-macht-ein-wal-in-der-themse,https://img.diepresse.com/public/incoming/tlk9d1-oisintiffjpg/alternates/DPR_SOCIAL_MAGAZIN/oisintiff.jpg,http://web.archive.org/web/20260206095242/https://www.diepresse.com/20550792/lebt-prinzessin-diana-noch-und-was-macht-ein-wal-in-der-themse,"Ein Wal ist gestrandet! Er steckt in der Themse fest! Das ist tragisch für den Wal und komisch für uns Leserinnen und Leser, denn auf den ersten Seiten wird mit viel Liebe zum absurden Detail beschri… [+6605 chars]",,"Lebt Prinzessin Diana noch? Und was macht ein Wal in der Themse? [premium]. Es gibt eine neue Tendenz zum freundlichen Erzählen, und Oisín McKenna ist einer ­ihrer schillerndsten Vertreter. In „Hitzetage“ möchte man alle Figuren am liebsten umarmen.","Is Princess Diana still alive? And what does a whale do in the Thames? [premium]. There is a new trend towards friendly storytelling, and Oisín McKenna is one of its most colorful representatives. In “Heat Days” you want to hug all the characters.","Estne principissa Diana adhuc vivit? Et quid facit cetus in Tamesis? [premium]. Nova inclinatio ad fabulas amicabiles exsistit, et Oisín McKenna unum ex legatis coloratis est. In ""Heat Dies"" omnia ingenia amplecti vis.",2026-02-08 13:28:00+00:00
066bf5be598f3b02a075d2a3aa11f6b0,2026-02-07T07:29:51Z,'Hitze Blow-ups',www.diepresse.com,de,0.9,„Hitzetage“ von Oisín McKenna: Die queeren Bücher sind immer die freundlichsten,Literaturempfehlung von Spectrum-Redakteurin Bettina Steiner,https://www.diepresse.com/20557700/hitzetage-von-oisin-mckenna-die-queeren-buecher-sind-immer-die,https://www.diepresse.com/assets_v2/images/diepresse_video.png,http://web.archive.org/web/20260207113917/https://www.diepresse.com/20557700/hitzetage-von-oisin-mckenna-die-queeren-buecher-sind-immer-die,"Literaturempfehlung von Spectrum-Redakteurin Bettina Steiner
Lesen Sie mehr zu diesen Themen:",,„Hitzetage“ von Oisín McKenna: Die queeren Bücher sind immer die freundlichsten. Literaturempfehlung von Spectrum-Redakteurin Bettina Steiner,“Heat Days” by Oisín McKenna: The queer books are always the friendliest. Recommended literature from Spectrum editor Bettina Steiner,"""Dies caloris"" by Oisín McKenna: Queer libri semper amicissimi sunt. Litterae commendantur ab editore Imaginis Bettina Steiner",2026-02-08 13:28:00+00:00
