index,published,keyword,domain,language,valid,title,description,url,image,archive,content,quote,de,en,la,added
c8761c9b5a895e1aa131212da4a137f5,2025-12-01T08:33:02Z,'Klimawandel',www.zeit.de,de,0.9,Unwetterkatastrophe: Noch hunderte Vermisste nach Unwetter in Asien,"Bei den Überschwemmungen in Indonesien, Sri Lanka und Thailand sind mehr als 1.000 Menschen gestorben. Indonesiens Präsident fordert mehr Einsatz gegen den Klimawandel.",https://www.zeit.de/gesellschaft/2025-12/unwetterkatastrophe-asien-tote-vermisste,https://img.zeit.de/administratives/sharing/fallback-image-die-zeit/wide__1300x731,,"Nach Überschwemmungen in Indonesien, Sri Lanka und Thailand werden noch immer hunderte Menschen vermisst. Der indonesische Präsident Prabowo Subianto versprach bei einem Besuch betroffener Gebiete au… [+750 chars]",,"Unwetterkatastrophe: Noch hunderte Vermisste nach Unwetter in Asien. Bei den Überschwemmungen in Indonesien, Sri Lanka und Thailand sind mehr als 1.000 Menschen gestorben. Indonesiens Präsident fordert mehr Einsatz gegen den Klimawandel.","Storm disaster: Hundreds still missing after storm in Asia. More than 1,000 people have died in floods in Indonesia, Sri Lanka and Thailand. Indonesia's president calls for more action against climate change.","Tempestas calamitas est: Centum adhuc desunt post tempestatem in Asia. Plus quam 1,000 homines in Indonesia, Sri Lanka et Thailandia in inundationibus mortui sunt. Praesidens Indonesia maiorem actionem contra mutationem climatis vocat.",2025-12-06 06:50:41+00:00
28e7439e8aa55a4c966cf7bc5487d67d,2025-12-05T14:08:06Z,'Klimaschutz',www.stern.de,de,0.9,Greenwashing: Urteil: Eurowings-Werbung zu CO2-Zahlung führt in die Irre,"Wer beim Fliegen ein schlechtes Gewissen hat, dass sein Reiseverhalten dem Klima schadet, der kann Klimaschutzprojekte unterstützen. Solche Zahlungen bewarb Eurowings - und ging dabei wohl zu weit.",https://www.stern.de/wirtschaft/news/greenwashing--urteil--eurowings-werbung-zu-co2-zahlung-fuehrt-in-die-irre-36933086.html,https://image.stern.de/36933088/t/15/v1/w1440/r1.7778/-/05--olht6vvupnv8axs2048jpeg---3b678ff959927b63.jpg,,"Kopiere den aktuellen Link
Zur Merkliste hinzufügen
Wer beim Fliegen ein schlechtes Gewissen hat, dass sein Reiseverhalten dem Klima schadet, der kann Klimaschutzprojekte unterstützen. Solche Zahlu… [+4037 chars]",,"Greenwashing: Urteil: Eurowings-Werbung zu CO2-Zahlung führt in die Irre. Wer beim Fliegen ein schlechtes Gewissen hat, dass sein Reiseverhalten dem Klima schadet, der kann Klimaschutzprojekte unterstützen. Solche Zahlungen bewarb Eurowings - und ging dabei wohl zu weit.","Greenwashing: Verdict: Eurowings advertising about CO2 payments is misleading. If you have a guilty conscience when flying that your travel behavior is damaging the climate, you can support climate protection projects. Eurowings advertised such payments - and probably went too far.","Greenwashing: Verdict: Eurowings vendo de CO2 praestationibus fallax. Si ream conscientiam habes, cum volans mores tuos peregrinationis climatis laedat, praesidia incepta caeli sustinere potes. Eurowings tales solutiones proscripsit - et probabiliter longius processit.",2025-12-06 18:49:01+00:00
16f9169f57740279d5cf86cf06e7a1dc,2025-12-05T14:09:00Z,'Klimaschutz',www.tagesspiegel.de,de,0.9,Greenwashing: Urteil: Eurowings-Werbung zu CO2-Zahlung führt in die Irre,"Wer beim Fliegen ein schlechtes Gewissen hat, dass sein Reiseverhalten dem Klima schadet, der kann Klimaschutzprojekte unterstützen. Solche Zahlungen bewarb Eurowings - und ging dabei wohl zu weit.",https://www.tagesspiegel.de/wirtschaft/greenwashing-urteil-eurowings-werbung-zu-co2-zahlung-fuhrt-in-die-irre-15023585.html,,,"Die Airline Eurowings hat ihre Kunden nach einem Urteil des Oberlandesgerichts (OLG) Düsseldorf mit Werbung für Klimaschutzmaßnahmen in die Irre geführt. Dem Flugunternehmen wurde untersagt, auf eine… [+3592 chars]",,"Greenwashing: Urteil: Eurowings-Werbung zu CO2-Zahlung führt in die Irre. Wer beim Fliegen ein schlechtes Gewissen hat, dass sein Reiseverhalten dem Klima schadet, der kann Klimaschutzprojekte unterstützen. Solche Zahlungen bewarb Eurowings - und ging dabei wohl zu weit.","Greenwashing: Verdict: Eurowings advertising about CO2 payments is misleading. If you have a guilty conscience when flying that your travel behavior is damaging the climate, you can support climate protection projects. Eurowings advertised such payments - and probably went too far.","Greenwashing: Verdict: Eurowings vendo de CO2 praestationibus fallax. Si ream conscientiam habes, cum volans mores tuos peregrinationis climatis laedat, praesidia incepta caeli sustinere potes. Eurowings tales solutiones proscripsit - et probabiliter longius processit.",2025-12-06 18:49:01+00:00
2f4d2153ccf0328f3726f4acd82de32d,2025-12-05T16:21:00Z,'Klimaschutz',taz.de,de,0.9,Regierung lobbyiert gegen Verbrenner-Aus: Die drei wichtigsten Klima-News der Woche,Was sollen „hocheffiziente Verbrenner“ sein? Greentech wächst enorm. Was der Armuts- und Reichtumsbericht der Regierung zum Klimaschutz sagt.,https://taz.de/Regierung-lobbyiert-gegen-Verbrenner-Aus/!6135581/,https://taz.de/picture/8109361/1200/00-QuadratMitTaz.jpeg,,Was sollen „hocheffiziente Verbrenner“ sein? Greentech wächst enorm. Was der Armuts- und Reichtumsbericht der Regierung zum Klimaschutz sagt. mehr...,,Regierung lobbyiert gegen Verbrenner-Aus: Die drei wichtigsten Klima-News der Woche. Was sollen „hocheffiziente Verbrenner“ sein? Greentech wächst enorm. Was der Armuts- und Reichtumsbericht der Regierung zum Klimaschutz sagt.,Government lobbies against combustion engine shutdown: The three most important climate news of the week. What should “highly efficient combustion engines” be? Greentech is growing enormously. What the government's poverty and wealth report says about climate change.,Regimen lobbies contra machinam combustionem shutdown: tres principales nuntium climatis septimanatim. Quid sit machinationes combustiones valde efficaces? Greentech crescit in immensum. Quid de paupertate et divitiis rumore imperii dixerit de mutatione climatis.,2025-12-06 18:49:01+00:00
