index,published,keyword,domain,language,valid,title,description,url,image,archive,content,quote,de,en,la,added
5b55417e7e5574ba02a3ef96893bd98a,2026-01-05T04:30:00Z,'Rekordtemperaturen',www.nzz.ch,de,0.9,Korallen im Roten Meer überleben auch grosse Hitze. Das könnte im Klimawandel hilfreich sein,Vielerorts sterben die Korallenriffe ab. Doch manche Korallenarten zeigen viel Widerstandskraft: Sie überstehen hohe Temperaturen oder besiedeln neue Orte wie das Mittelmeer. Was bedeutet das für die Zukunft der Riffe?,https://www.nzz.ch/wissenschaft/hitzetolerante-korallen-im-roten-meer-hoffnung-fuer-riffe-ld.1914676,"https://img.nzz.ch/2025/12/03/ef9b4310-998a-48d8-8c77-c540d233ef16.png?width=1200&height=674&fit=bounds&quality=75&auto=webp&crop=5663,3185,x0,y0&wmark=nzz",,Vielerorts sterben die Korallenriffe ab. Doch manche Korallenarten zeigen viel Widerstandskraft: Sie überstehen hohe Temperaturen oder besiedeln neue Orte wie das Mittelmeer. Was bedeutet das für die… [+9923 chars],,Korallen im Roten Meer überleben auch grosse Hitze. Das könnte im Klimawandel hilfreich sein. Vielerorts sterben die Korallenriffe ab. Doch manche Korallenarten zeigen viel Widerstandskraft: Sie überstehen hohe Temperaturen oder besiedeln neue Orte wie das Mittelmeer. Was bedeutet das für die Zukunft der Riffe?,Corals in the Red Sea also survive extreme heat. This could be helpful in climate change. Coral reefs are dying in many places. But some coral species show a lot of resilience: they survive high temperatures or colonize new places such as the Mediterranean. What does this mean for the future of the reefs?,Corallii in rubro mari etiam nimio calore supervivunt. Hoc potest esse utile in mutatione climatis. Corallii multis in locis moriuntur. Sed aliquae species corallium multum mollitiae ostendunt: caliditas inhabitat vel nova loca coloni sicut Mediterraneum. Quid est hoc scopulis futurum?,2026-01-15 19:03:34+00:00
2463ef858056e83cd37c63679777c84e,2026-01-15T13:36:37Z,'Wasserknappheit',www.zeit.de,de,0.9,Wassermangel: Deutschland drohen laut Nabu hohe Schäden durch Wasserknappheit,"Seit Anfang des Jahrhunderts hat Deutschland rund 60 Milliarden Kubikmeter Wasser verloren, wie eine Studie zeigt. Das soll sich auf Land- und Volkswirtschaft auswirken.",https://www.zeit.de/politik/deutschland/2026-01/wasserknappheit-nabu-warnung-erderwaermung-deutschland,https://img.zeit.de/wissen/2026-01/nabu-deutschland-droht-wasserstress-bild/wide__1300x731,http://web.archive.org/web/20260115140746/https://www.zeit.de/politik/deutschland/2026-01/wasserknappheit-nabu-warnung-erderwaermung-deutschland,Die Umweltorganisation Naturschutzbund (Nabu) warnt vor erheblichen Schäden durch Wasserknappheit im landwirtschaftlichen Bereich und der gesamten Volkswirtschaft. Deutschland habe seit Anfang des Ja… [+553 chars],,"Wassermangel: Deutschland drohen laut Nabu hohe Schäden durch Wasserknappheit. Seit Anfang des Jahrhunderts hat Deutschland rund 60 Milliarden Kubikmeter Wasser verloren, wie eine Studie zeigt. Das soll sich auf Land- und Volkswirtschaft auswirken.","Water shortage: According to Nabu, Germany is threatened with high damage from water shortages. Since the beginning of the century, Germany has lost around 60 billion cubic meters of water, a study shows. This should have an impact on the country and national economy.","Aquae penuriae: Secundum Nabu, Germania magnis damnis ab aquarum penuria imminet. Ab ineunte saeculo, Germania circiter 60 miliarda metrorum cubicorum aquae amisit, studium ostendit. Hoc attingere debet in oeconomiam publicam et nationalem.",2026-01-18 03:24:04+00:00
de08353a80a0807e6c5e18960c982523,2026-01-18T07:39:00Z,'Erschöpfung Hitze',www.dw.com,de,0.3,USA - Städte kämpfen um Solar- und Windprojekte,"Trotz Donald Trumps Förderstopps für Erneuerbare Energien kämpfen Gemeinden und Städte in den USA darum, ihre Solar- und Wind-Projekte zu erhalten. Wie Innovation und Transformation auf lokaler Ebene weitergehen.",https://www.dw.com/de/usa-trump-stoppt-solar-und-wind-projekte-erneuerbare-energie-strom-klimawandel/a-74942609,https://static.dw.com/image/72530489_6.jpg,,"Anh Nguyen aus Atlanta im US-Bundesstaat Georgia zahlt jeden Monat fast 500 Dollar (431 Euro) für Strom. Sie hat vieles versucht, um die Kosten zu senken, etwa bei großer Hitze die Klimaanlage nur no… [+7858 chars]",,"USA - Städte kämpfen um Solar- und Windprojekte. Trotz Donald Trumps Förderstopps für Erneuerbare Energien kämpfen Gemeinden und Städte in den USA darum, ihre Solar- und Wind-Projekte zu erhalten. Wie Innovation und Transformation auf lokaler Ebene weitergehen.","USA - Cities fight for solar and wind projects. Despite Donald Trump's funding freezes for renewable energy, communities and cities in the USA are fighting to maintain their solar and wind projects. How innovation and transformation continues at the local level.","USA - Civitates pro inceptis solis et venti pugnant. Quamvis Donald Trump subsidio energiae renovandae coit, communitates et civitates in USA pugnant ut incepta sua solaris et venti conservare contendant. Quomodo innovatio et transmutatio perstet in gradu locali.",2026-01-20 07:02:29+00:00
fd625b98d4324cd30c330b6e23ac6a97,2026-01-19T18:30:00Z,'Hochsommer',www.urlaubspiraten.de,de,0.9,"Flüge nach Mallorca: Vorsaison ab 30 €, Hochsommer ab 60 € ","Da sind über Nacht wohl die Preise gefallen  Flüge nach Mallorca zur Vorsaion, egal ob kurzfristig im Februar oder im wärmeren April, gibt es ab 30 Euro für den Hin- und Rückflug (zzgl. Gepäckkosten). Selbst im Hochsommer gibt es viele Termine ab bereits …",https://www.urlaubspiraten.de/fluege/guenstige-fluege-nach-mallorca,https://image.urlaubspiraten.de/720/image/upload/v1721311885/mediavault_images/shutterstock_2075569549_pvfkfh.jpg,,"Wir nutzen Cookies, um deine Nutzererfahrung zu verbessern, dir persönlich auf dich zugeschnittene Inhalte liefern zu können und die Nutzung unserer App zu analysieren. Wenn du auf ""alle akzeptieren""… [+435 chars]",,"Flüge nach Mallorca: Vorsaison ab 30 €, Hochsommer ab 60 € . Da sind über Nacht wohl die Preise gefallen  Flüge nach Mallorca zur Vorsaion, egal ob kurzfristig im Februar oder im wärmeren April, gibt es ab 30 Euro für den Hin- und Rückflug (zzgl. Gepäckkosten). Selbst im Hochsommer gibt es viele Termine ab bereits …","Flights to Mallorca: low season from €30, midsummer from €60. The prices have probably fallen overnight. Flights to Mallorca in the pre-season, whether at short notice in February or in the warmer April, are available from 30 euros for the return flight (plus luggage costs). Even in midsummer there are many dates already available...","Volatus ad Mallorcam: tempus humile ab €30, aestas ab €60. Pretia probabiliter corruerunt pernoctare. Volatus ad Mallorcam in praecedente tempore, sive mense Februario sive in calidiore Aprili celeriter, praesto sunt ex XXX nummis Europaeis fugae reditus (plus sarcinas impensae). Etiam solstitio multae dies iam in promptu sunt.",2026-01-22 07:01:02+00:00
f51fd2572ef8ed838eddf3307d549ca8,2026-01-10T11:35:08Z,'Hitzebelastung',tirol.orf.at,de,0.8,Klimaanalysen für alle neun Bezirke,"Das Land Tirol hat die Klimaanalysen auf alle neun Bezirke ausgeweitet. Im Herbst letztes Jahres wurden Hitzehotspots und Kaltluftströme im Inntal analysiert. Nun wird es auch für die Regionen Lienz, Reutte und im Raum Kitzbühel bis St. Johann Analysen geben.",https://tirol.orf.at/stories/3337259/,https://ibs.orf.at/tir?image=https%3A%2F%2Foekastatic.orf.at%2Fmims%2F2025%2F25%2F28%2Fcrops%2Fw%3D1200%2Ch%3D627%2Cq%3D75%2F2669257_master_1026428_dsc_8620-1.jpg%3Fs%3D15e4427e03e6cad417edd0dc4ddd1f56fbb145b9,http://web.archive.org/web/20260110122157/https://tirol.orf.at/stories/3337259/,Klimaanalysen sollen künftig in allen neun Bezirken als Instrument für Raumplanung und Bebauung verfügbar sein. Auf einer interaktiven Karte sind die Messungen und Analysen im Inntal bereits einsehba… [+1181 chars],,"Klimaanalysen für alle neun Bezirke. Das Land Tirol hat die Klimaanalysen auf alle neun Bezirke ausgeweitet. Im Herbst letztes Jahres wurden Hitzehotspots und Kaltluftströme im Inntal analysiert. Nun wird es auch für die Regionen Lienz, Reutte und im Raum Kitzbühel bis St. Johann Analysen geben.","Climate analyzes for all nine districts. The state of Tyrol has expanded climate analyzes to all nine districts. Last autumn, heat hotspots and cold air flows in the Inn Valley were analyzed. There will now also be analyzes for the regions of Lienz, Reutte and in the Kitzbühel to St. Johann area.","Clima analyses pro omnibus novem regionibus. Status Tyrolis in omnes novem regiones analyses climatis dilatavit. Autumno proximo, calor hotspotum et frigidum aeris influit, in valle Inn enucleata sunt. Nunc etiam analyses erunt pro regionibus Lienz, Reutte et in Kitzbühel ad S. Johann aream.",2026-01-23 13:25:55+00:00
d83c7ede334493be28b9c8d1b21393b8,2026-01-23T07:17:26Z,'Klimaanlage',www.bild.de,de,0.8,40 Grad Hitze erwartet - Die Australian OFEN sind zurück,"Extreme Temperaturen fordern Spieler in Melbourne heraus. Maßnahmen, wie früherer Spielbeginn, sollen helfen.",https://www.bild.de/sport/mehr-sport/melbournes-wetterchaos-bei-australian-open-hitze-trifft-tennis-profis-69731939984ba86eab23afcc,"https://images.bild.de/69731939984ba86eab23afcc/9b37bd4e889bbc3e10a00ccc066c3abc,5e3e7137?w=1280",,"Man nennt sie die Stadt der vier Jahreszeiten an einem Tag!
Melbourne macht auch bei diesen Australian Open seinem Namen alle Ehre! Nachdem es in den vergangenen Tagen für einen australischen Sommer… [+1926 chars]",,"40 Grad Hitze erwartet - Die Australian OFEN sind zurück. Extreme Temperaturen fordern Spieler in Melbourne heraus. Maßnahmen, wie früherer Spielbeginn, sollen helfen.",40 degree heat expected - The Australian OVENS are back. Extreme temperatures challenge players in Melbourne. Measures such as starting games earlier should help.,40 gradus caloris exspectantur - The Australian ovens are back. Extremae temperaturae nisl in Melbourne provocatio. Mensuras ut ludos incipientes antea adiuvare debent.,2026-01-24 18:53:52+00:00
f793ac10101589cf824a69a8b8fe35fa,2026-01-05T18:19:42Z,'Klimawandel',www.tagesschau.de,de,0.9,Welche Region wie stark vom Klimawandel bedroht ist,"Stürme, Starkregen - Hitze: Eine neue Studie zeigt, wie stark deutsche Regionen vom Klimawandel bedroht sind. Besonders gefährdet sind Städte in der Nähe von Küsten und Flüssen.",https://www.tagesschau.de/wissen/klima/iw-klimarisikoindex-100.html,https://images.tagesschau.de/image/69e14ac0-97d2-4654-b00e-78716057f0a1/AAABm44RCJw/AAABmyZE0EA/16x9-big/dunkle-wolken-100.jpg?width=1280,http://web.archive.org/web/20260105230536/https://www.tagesschau.de/wissen/klima/iw-klimarisikoindex-100.html,"Stand: 05.01.2026 19:19 Uhr
Stürme, Starkregen - Hitze: Eine neue Studie zeigt, wie stark deutsche Regionen vom Klimawandel bedroht sind. Besonders gefährdet sind Städte in der Nähe von Küsten und F… [+1880 chars]",,"Welche Region wie stark vom Klimawandel bedroht ist. Stürme, Starkregen - Hitze: Eine neue Studie zeigt, wie stark deutsche Regionen vom Klimawandel bedroht sind. Besonders gefährdet sind Städte in der Nähe von Küsten und Flüssen.","Which region is threatened by climate change and to what extent. Storms, heavy rain - heat: A new study shows how seriously German regions are threatened by climate change. Cities near coasts and rivers are particularly at risk.","Quae regio mutatione climatis et quatenus imminet. Tempestates, pluviae graves - calor: Novum studium ostendit quam graviter regiones Germanorum mutationem climatis immineant. Urbes iuxta oras et flumina maxime periclitantur.",2026-01-25 13:11:06+00:00
56b11805386ec94bb519924455672c74,2026-01-14T03:47:30Z,'Klimawandel',www.morgenpost.de,de,0.9,Klimawandel: 2025 war drittwärmstes Jahr seit Aufzeichnungsbeginn,"Die Klimakrise spitzt sich weiter zu: Erstmals lag die Temperatur im Drei-Jahres-Durchschnitt bei über 1,5 Grad Erderwärmung.",https://www.morgenpost.de/panorama/article410928964/klimawandel-2025-war-drittwaermstes-jahr-seit-aufzeichnungsbeginn.html,https://img.sparknews.funkemedien.de/410929050/410929050_1768362349_v16_9_1600.jpeg,http://web.archive.org/web/20260115033302/https://www.morgenpost.de/panorama/article410928964/klimawandel-2025-war-drittwaermstes-jahr-seit-aufzeichnungsbeginn.html,Das vergangene Jahr 2025 ist das drittwärmste Jahr seit Beginn der Aufzeichnungen gewesen. Das geht aus Daten des EU-Klimadienstes Copernicus hervor. Laut den am Mittwoch in Bonn veröffentlichten Zah… [+4380 chars],,"Klimawandel: 2025 war drittwärmstes Jahr seit Aufzeichnungsbeginn. Die Klimakrise spitzt sich weiter zu: Erstmals lag die Temperatur im Drei-Jahres-Durchschnitt bei über 1,5 Grad Erderwärmung.","Climate change: 2025 was the third warmest year on record. The climate crisis continues to worsen: for the first time, the three-year average temperature was over 1.5 degrees Celsius.",Mutatio climatis: 2025 annus in memoria erat tertius calidissimus. Discrimen climatis peior pergit: primum tres annos temperatura mediocris Celsius supra 1.5 gradus fuit.,2026-01-25 13:11:06+00:00
4cb8f1b42ff4b700c2163f3f56a08435,2026-01-14T05:16:31Z,'Hitzestress',www.faz.net,de,0.9,Klimawandel: 2025 war drittwärmstes Jahr überhaupt – nach 2024 und 2023,"Für das Pariser Klimaziel gibt es so gut wie keine Hoffnung mehr. Erstmals liegen EU-Berechnungen zufolge drei Jahre im Schnitt mehr als 1,5 Grad über dem vorindustriellen Niveau. Lokale Ausreißer ändern nichts daran.",https://www.faz.net/aktuell/wissen/erde-klima/klimawandel-2025-drittwaermstes-jahr-ueberhaupt-accg-200436212.html,https://media0.faz.net/image/w1200h627/9599d9dfe672/w6192h3235x0y447o/202601/43601.0.1662603486/im-brasilianischen-bundesstaat.webp,http://web.archive.org/web/20260115035151/https://www.faz.net/aktuell/wissen/erde-klima/klimawandel-2025-drittwaermstes-jahr-ueberhaupt-accg-200436212.html,"Das vergangene Jahr ist das drittwärmste seit Beginn der Aufzeichnungen gewesen. 2025 war nur geringfügig kühler als 2023, und 2024 bleibt das wärmste Jahr seit Beginn der Aufzeichnungen, erklärte Sa… [+4569 chars]",,"Klimawandel: 2025 war drittwärmstes Jahr überhaupt – nach 2024 und 2023. Für das Pariser Klimaziel gibt es so gut wie keine Hoffnung mehr. Erstmals liegen EU-Berechnungen zufolge drei Jahre im Schnitt mehr als 1,5 Grad über dem vorindustriellen Niveau. Lokale Ausreißer ändern nichts daran.","Climate change: 2025 was the third warmest year ever - after 2024 and 2023. There is almost no hope left for the Paris climate target. For the first time, according to EU calculations, the three-year average is more than 1.5 degrees above pre-industrial levels. Local outliers don't change that.","Mutatio climatis: 2025 annus calidissimus fuit tertius umquam - post 2024 et 2023. Nulla fere spes superest scopum climatis Parisiensis. Primum, secundum calculis EU, mediocris trium annorum plus quam 1.5 gradus supra gradus industriae praecellens est. Locus manor non mutare.",2026-01-25 13:11:06+00:00
c1fe7898e8abf308326a0c0875818456,2026-01-18T19:34:35Z,'Klimawandel',www.basicthinking.de,de,0.9,Klimawandel: Diese deutschen Regionen sind besonders bedroht,"Der Beitrag Klimawandel: Diese deutschen Regionen sind besonders bedroht erschien zuerst beim Online-Magazin BASIC thinking. Über unseren Newsletter UPDATE startest du jeden Morgen bestens informiert in den Tag.
Der Klimawandel ist schon lange keine abstrakte…",https://www.basicthinking.de/blog/2026/01/18/klimawandel-deutschen-regionen-besonders-bedroht/,https://www.basicthinking.de/blog/wp-content/uploads/2026/01/klimawandel-unsplash-kelly-sikkema-jpg.png,http://web.archive.org/web/20260122054146/https://www.basicthinking.de/blog/2026/01/18/klimawandel-deutschen-regionen-besonders-bedroht/,"Der Klimawandel ist schon lange keine abstrakte Gefahr mehr, sondern eine konkrete Belastung für die Infrastruktur deutscher Städte und Gemeinden. Ein aktueller Index zeigt auf, wo bis 2050 das höchs… [+2207 chars]",,"Klimawandel: Diese deutschen Regionen sind besonders bedroht. Der Beitrag Klimawandel: Diese deutschen Regionen sind besonders bedroht erschien zuerst beim Online-Magazin BASIC thinking. Über unseren Newsletter UPDATE startest du jeden Morgen bestens informiert in den Tag.
Der Klimawandel ist schon lange keine abstrakte…","Climate change: These German regions are particularly threatened. The article Climate change: These German regions are particularly threatened was first published by the online magazine BASIC thinking. With our newsletter UPDATE you can start the day well informed every morning.
Climate change is no longer an abstract issue…","Mutatio climatis: Hae regiones Germanorum maxime minantur. Articulus mutationis climatis: Hae regiones Germanorum maxime minatae sunt, primum ab e programmatis emporium fundamentalis editum est. Cum Newsletter nostro UPDATE diem inire potes omni mane bene conscio.
Clima mutatio non est exitus abstractus...",2026-01-25 13:11:06+00:00
5a66b5e8c8960c2aac32e0cb73a7683a,2026-01-19T04:30:00Z,'Hitze Blow-ups',www.nzz.ch,de,0.9,"Nachdem Tennisspieler bei über 40 Grad kollabiert sind, hat das Australian Open eine Formel berechnet, die Leben retten soll",Auch für das laufende Turnier in Melbourne sind extreme Hitzetage vorausgesagt.,https://www.nzz.ch/sport/tennis/tennis-bei-40-grad-mit-dieser-formel-wollen-die-australian-open-leben-retten-ld.1920392,"https://img.nzz.ch/2026/01/18/f867c55b-fb1e-4278-9ae7-88aa3663f270.jpg?width=1200&height=674&fit=bounds&quality=75&auto=webp&crop=2200,1237,x0,y152&wmark=nzz",,"Auch für das laufende Turnier in Melbourne sind extreme Hitzetage vorausgesagt.
Barbara Barkhausen, Sydney19.01.2026, 05.30 Uhr
Der kanadische Tennisspieler Frank Dancevic kühlt sich 2014 an den Au… [+6154 chars]",,"Nachdem Tennisspieler bei über 40 Grad kollabiert sind, hat das Australian Open eine Formel berechnet, die Leben retten soll. Auch für das laufende Turnier in Melbourne sind extreme Hitzetage vorausgesagt.","After tennis players collapsed in temperatures over 40 degrees, the Australian Open has calculated a formula that should save lives. Extremely hot days are also predicted for the current tournament in Melbourne.","Postquam tennis histriones in temperaturis supra 40 gradus conciderunt, Aperi Australiae formulam estimavit quae vitam servare deberent. Dies calidissimi etiam de currenti torneamento in Melbourne praedicuntur.",2026-01-25 13:11:06+00:00
300a0608ac063f6887ab38e83ad521a3,2026-01-25T10:15:53Z,'Klimaschutz',www.sueddeutsche.de,de,0.9,Klimaschutz-Aktion: Münchner spenden der Fußgängerzone genau einen Schatten,Im Sommer warb Oberbürgermeister die Münchner um Spenden für neue Bäume in der Altstadt. Bisher gingen knapp 70 000 Euro ein. Das reicht für einen Baum.,https://www.sueddeutsche.de/muenchen/muenchen-klimaschutz-altstadt-baumspenden-li.3371707,https://www.sueddeutsche.de/2025/08/25/6cde3f24-c9c5-475b-8bc6-076d38bd1be9.jpg?q=60&fm=webp&width=1200&rect=97%2C582%2C2732%2C1536,,"Es kommt nicht alle Tage vor, dass der Münchner Oberbürgermeister auf die Straße geht und die Münchner um Geld bittet. Im vergangenen Jahr geschah genau das. Dieter Reiter stellte sich Ende August in… [+2862 chars]",,Klimaschutz-Aktion: Münchner spenden der Fußgängerzone genau einen Schatten. Im Sommer warb Oberbürgermeister die Münchner um Spenden für neue Bäume in der Altstadt. Bisher gingen knapp 70 000 Euro ein. Das reicht für einen Baum.,"Climate protection campaign: Munich residents give the pedestrian zone exactly one shade. In the summer, the mayor asked Munich residents to donate for new trees in the old town. So far almost 70,000 euros have been received. That's enough for one tree.","Expeditio tutelae climatis: Munich incolas zonam pedestrem prorsus unam umbram dant. Maior aestate Monacensis incolas rogavit ut novas arbores in oppido veteri donaret. Hactenus fere 70,000 nummis recepta sunt. Satis est una arbor.",2026-01-28 13:30:23+00:00
26106136f78ea7665154588a52c93dae,2026-01-18T14:59:47Z,'stabile Wetterlage',www.stern.de,de,0.9,Wetter: Nach milderen Temperaturen wird es deutlich kälter,"Hannover (lni) - Freundlich, trocken, sonnig – Winterwetter ohne Schnee: Ein Hochdruckgebiet sorgt in Niedersachsen und Bremen für eine stabile",https://www.stern.de/gesellschaft/regional/niedersachsen-bremen/wetter--nach-milderen-temperaturen-wird-es-deutlich-kaelter-37052506.html,https://image.stern.de/37052508/t/hh/v1/w1440/r1.7778/-/18--ra4h72cbpyv5axs2048jpeg---7577072e98901c42.jpg,http://web.archive.org/web/20260119051455/https://www.stern.de/gesellschaft/regional/niedersachsen-bremen/wetter--nach-milderen-temperaturen-wird-es-deutlich-kaelter-37052506.html,"Kopiere den aktuellen Link
Zur Merkliste hinzufügen
Vor allem in den Nächten sinken die Temperaturen in Niedersachen und Bremen, es gibt Frost.
Freundlich, trocken, sonnig Winterwetter ohne Schnee… [+1530 chars]",,"Wetter: Nach milderen Temperaturen wird es deutlich kälter. Hannover (lni) - Freundlich, trocken, sonnig – Winterwetter ohne Schnee: Ein Hochdruckgebiet sorgt in Niedersachsen und Bremen für eine stabile","Weather: After milder temperatures it gets significantly colder. Hanover (lni) - Friendly, dry, sunny - winter weather without snow: a high pressure area ensures stability in Lower Saxony and Bremen","Tempestas: Post leniores calores significanter frigidiores accipit. Hanover (lni) - Friendly, sicca, aprica - hiemalis tempestas sine nivis: magna pressionis regio stabilitatem efficit in Saxonia inferiori et Bremensi.",2026-01-28 19:01:37+00:00
62075d3c8a3e1e6478ec84f44a8a220a,2026-01-26T14:06:38Z,'Hitze Blow-ups',www.stern.de,de,0.8,Studie: Viele Länder nicht auf Zunahme extremer Hitze vorbereitet,"Bis 2050 könnten einer Studie zufolge fast 3,8 Milliarden Menschen weltweit unter extremer Hitze leiden - viele Länder sind bisher aber völlig unzureichend auf diese Entwicklung vorbereitet. In bevölkerungsreichen Ländern wie Brasilien, Indonesien oder Nigeri…",https://www.stern.de/news/studie--viele-laender-nicht-auf-zunahme-extremer-hitze-vorbereitet-37077774.html,https://image.stern.de/37077776/t/VX/v1/w1440/r1.7778/-/26--hitze-ist-fuer-den-koerper-eine-extreme-belastung---4c7d17f3f70c6703.jpg,,"Kopiere den aktuellen Link
Zur Merkliste hinzufügen
Bis 2050 könnten einer Studie zufolge fast 3,8 Milliarden Menschen weltweit unter extremer Hitze leiden - viele Länder sind bisher aber völlig un… [+3889 chars]",,"Studie: Viele Länder nicht auf Zunahme extremer Hitze vorbereitet. Bis 2050 könnten einer Studie zufolge fast 3,8 Milliarden Menschen weltweit unter extremer Hitze leiden - viele Länder sind bisher aber völlig unzureichend auf diese Entwicklung vorbereitet. In bevölkerungsreichen Ländern wie Brasilien, Indonesien oder Nigeri…","Study: Many countries not prepared for increase in extreme heat. According to a study, almost 3.8 billion people worldwide could suffer from extreme heat by 2050 - but many countries are completely inadequately prepared for this development. In populous countries such as Brazil, Indonesia or Nigeria...","Studere: Multae regiones in summo calore augendae non paratae sunt. Secundum studium, fere 3.8 miliarda hominum terrarum maximo ardore laborare potuerunt per MML - sed multae nationes huic evolutioni omnino insufficiens sunt. In regionibus celebribus ut Brasilia, Indonesia vel Nigeria...",2026-01-30 19:09:49+00:00
89959053fbfbe211b6c0e00731a7ecda,2026-01-20T14:16:49Z,'Hitzetage',www.stern.de,de,0.9,Wetterextreme: Klimawandel in Sachsen-Anhalt immer spürbarer,"Hitzetage im Tiefland haben sich verdoppelt, Schnee im Harz schwindet rapide: Wie Sachsen-Anhalt auf die neuen Klimafakten reagiert – und was das für den Alltag bedeutet.",https://www.stern.de/gesellschaft/regional/sachsen-anhalt/wetterextreme--klimawandel-in-sachsen-anhalt-immer-spuerbarer-37059440.html,https://image.stern.de/37059442/t/gx/v1/w1440/r1.7778/-/20--ixg7pcibsqv12axs2048jpeg---dfce539bfb3bb0ae.jpg,http://web.archive.org/web/20260121043308/https://www.stern.de/gesellschaft/regional/sachsen-anhalt/wetterextreme--klimawandel-in-sachsen-anhalt-immer-spuerbarer-37059440.html,"Kopiere den aktuellen Link
Zur Merkliste hinzufügen
Hitzetage im Tiefland haben sich verdoppelt, Schnee im Harz schwindet rapide: Wie Sachsen-Anhalt auf die neuen Klimafakten reagiert und was das f… [+1797 chars]",,"Wetterextreme: Klimawandel in Sachsen-Anhalt immer spürbarer. Hitzetage im Tiefland haben sich verdoppelt, Schnee im Harz schwindet rapide: Wie Sachsen-Anhalt auf die neuen Klimafakten reagiert – und was das für den Alltag bedeutet.","Weather extremes: Climate change is becoming increasingly noticeable in Saxony-Anhalt. Hot days in the lowlands have doubled, snow in the Harz Mountains is rapidly disappearing: How Saxony-Anhalt is reacting to the new climate facts - and what that means for everyday life.","Tempestas extrema: Clima mutatio in Saxonia-Anhalt magis magisque conspicitur. Calidi dies in campestribus geminaverunt, nix in Harz Montes celeriter evanescit: Quomodo Saxonia-Anhalt reagit ad nova facta caeli - et quid illud ad vitam cotidianam.",2026-01-30 19:09:49+00:00
