index,published,keyword,domain,language,valid,title,description,url,image,archive,content,quote,de,en,la,added
c83e4223b0fabb1ed15ca531ee76f428,2026-04-15T06:47:19Z,'Hitzschlag',www.sueddeutsche.de,de,0.8,Prozess in Würzburg: Vater soll Baby mehr als 30 Minuten im heißen Auto eingesperrt haben,"Das Kind erlitt laut Anklage eine beginnende Hitzeerschöpfung, schrie und schwitzte stark. Eine Passantin alarmierte die Polizei.  Jetzt muss sich der Mann wegen Aussetzung vor Gericht verantworten.",https://www.sueddeutsche.de/bayern/wuerzburg-prozess-baby-auto-hitze-li.3468192,https://www.sueddeutsche.de/2026/04/15/b84cac83-ebca-4220-a6d5-4cf3cb828c24.jpg?q=60&fm=webp&width=1200&rect=0%2C198%2C3823%2C2150,,"Polizisten befreiten das schreiende und verschwitzte Mädchen, nachdem eine Frau das fünf Monate alte Baby bemerkt hatte. Der Angeklagte war zu dieser Zeit nach Gerichtsangaben im Würzburger Stadtgebi… [+1247 chars]",,"Prozess in Würzburg: Vater soll Baby mehr als 30 Minuten im heißen Auto eingesperrt haben. Das Kind erlitt laut Anklage eine beginnende Hitzeerschöpfung, schrie und schwitzte stark. Eine Passantin alarmierte die Polizei.  Jetzt muss sich der Mann wegen Aussetzung vor Gericht verantworten.","Trial in Würzburg: Father is said to have locked baby in a hot car for more than 30 minutes. According to the prosecution, the child suffered from the onset of heat exhaustion, screamed and sweated profusely. A passer-by alerted the police.  Now the man has to answer in court for suspension.","Iudicium in Herbipoli: Pater infantem in autocineto calido clausum habuisse plus quam 30 minutas dicitur. Iuxta accusationem, puer ab impetu caloris fatigationis laborabat, clamabat et multum sudabat. A transeunte admoneantur magistratus.  Homo autem habet in iudicio respondere ad suspensionem.",2026-04-20 08:34:20+00:00
4be2071aa53626b29eb8fe34e0f3d375,2026-04-15T01:30:10Z,'Hitzschlag',www.stern.de,de,0.9,Eingesperrt im Auto: Vater lässt Baby bei Sommerhitze im Auto zurück - Prozess,Kinder oder Tiere dürfen bei sommerlichen Temperaturen nie allein im Auto zurückgelassen werden - auch nicht nur ganz kurz. Denn der Innenraum heizt sich schnell auf. Dann wird es gefährlich.,https://www.stern.de/gesellschaft/regional/bayern/eingesperrt-im-auto--vater-laesst-baby-bei-sommerhitze-im-auto-zurueck---prozess-37309634.html,https://image.stern.de/37309636/t/aj/v1/w1440/r1.7778/-/15--3a5ehclco5v1axs2048jpeg---aa5d6a1f5e35527d.jpg,,"Kopiere den aktuellen Link
Zur Merkliste hinzufügen
Kinder oder Tiere dürfen bei sommerlichen Temperaturen nie allein im Auto zurückgelassen werden - auch nicht nur ganz kurz. Denn der Innenraum he… [+1620 chars]",,Eingesperrt im Auto: Vater lässt Baby bei Sommerhitze im Auto zurück - Prozess. Kinder oder Tiere dürfen bei sommerlichen Temperaturen nie allein im Auto zurückgelassen werden - auch nicht nur ganz kurz. Denn der Innenraum heizt sich schnell auf. Dann wird es gefährlich.,Locked in the car: Father leaves baby in car in summer heat - trial. Children or animals must never be left alone in the car in summer temperatures - even for a short time. Because the interior heats up quickly. Then it becomes dangerous.,In autocineto clausum: Pater infantem in autocineto calore aestivo relinquit - iudicium. Pueri vel animalia numquam solum in autocineto temperaturae aestivae — etiam ad breve tempus relinquendae sunt. Quia intus cito calefacit. Tunc periculosum est.,2026-04-20 08:34:20+00:00
ca7a4c4ac5aad2fa7c5ea46e0b6481f9,2026-04-15T01:30:10Z,'Hitzschlag',www.zeit.de,de,0.9,Eingesperrt im Auto: Vater lässt Baby bei Sommerhitze im Auto zurück - Prozess,Hier finden Sie Informationen zu dem Thema „Eingesperrt im Auto“. Lesen Sie jetzt „Vater lässt Baby bei Sommerhitze im Auto zurück - Prozess“.,https://www.zeit.de/news/2026-04/15/vater-laesst-baby-bei-sommerhitze-im-auto-zurueck-prozess,https://img.zeit.de/news/2026-04/15/vater-laesst-baby-bei-sommerhitze-im-auto-zurueck-prozess-image-group/wide__1300x731,,"Weil er sein Baby bei Sommerhitze in einem verschlossenen Auto zurückgelassen haben soll, steht ein Vater vor dem Amtsgericht Würzburg (10.00 Uhr). Dem Mann, der zur Tatzeit im Juli 2024 40 Jahre alt… [+1412 chars]",,Eingesperrt im Auto: Vater lässt Baby bei Sommerhitze im Auto zurück - Prozess. Hier finden Sie Informationen zu dem Thema „Eingesperrt im Auto“. Lesen Sie jetzt „Vater lässt Baby bei Sommerhitze im Auto zurück - Prozess“.,Locked in the car: Father leaves baby in car in summer heat - trial. Here you will find information on the topic of “Locked in the car”. Now read “Father leaves baby in car in summer heat – trial”.,"In autocineto clausum: Pater infantem in autocineto calore aestivo relinquit - iudicium. Hic informationes invenies in argumento ""In autocineto clausa"". Nunc lege ""Pater infantem in autocineto aestu aestate - iudicii relinquit"".",2026-04-20 08:34:20+00:00
d0545915a722c2453d72af5bce2ed719,2026-04-01T16:17:46Z,'Klimaschutz',www.tagesspiegel.de,de,0.9,Wenn Bürger den Klimaschutz selbst vorantreiben: Potsdamer „Green Visions“ geht im Mai in die dritte Ausgabe,Treibhausgase und schmelzende Gletscher: Das grüne Filmfestival sucht vom 28. bis zum 31. Mai im Filmmuseum wieder nach Antworten auf Klimaschutzfragen – mit Optimismus.,https://www.tagesspiegel.de/potsdam/potsdam-kultur/wenn-burger-den-klimaschutz-selbst-vorantreiben-potsdamer-green-visions-geht-im-mai-in-die-dritte-ausgabe-15423681.html,https://www.tagesspiegel.de/images/15424111/alternates/BASE_16_9_W1400/1775038867000/trop-chaud-mattogrosso-films.jpeg,,"Wie viel Klimaschutz schulden Staaten ihren Bürgern? Mehr, war die Antwort einer Gruppe von Schweizer Seniorinnen. Mit der deutschen Festivalpremiere des Dokumentarfilms Trop Chaud  Klima-Seniorinnen… [+84 chars]",,Wenn Bürger den Klimaschutz selbst vorantreiben: Potsdamer „Green Visions“ geht im Mai in die dritte Ausgabe. Treibhausgase und schmelzende Gletscher: Das grüne Filmfestival sucht vom 28. bis zum 31. Mai im Filmmuseum wieder nach Antworten auf Klimaschutzfragen – mit Optimismus.,When citizens promote climate protection themselves: Potsdam's “Green Visions” enters its third edition in May. Greenhouse gases and melting glaciers: The green film festival from May 28th to 31st at the Film Museum is once again looking for answers to climate protection questions – with optimism.,"Cum cives se tutelam climatis promovent: Potsdam scriptor ""Visiones Green"" tertiam suam editionem mense Maio intrat. CONSERVATORIUM gasorum et molibus liquescens: Viridis cinematographicis festis a die 28 mensis Maii ad 31 in membrana Museum semel iterum quaerens responsa ad quaestiones tutelae climatis - cum spe.",2026-04-21 04:31:35+00:00
5d06e94172c450bb7fd0fdfd2e8a6699,2026-04-01T18:21:07Z,'Treibhausgase',www.n-tv.de,de,0.9,"""Unterschätzen Klimawirkung"": Treibstoff wohl entscheidend für Bildung von Kondensstreifen","Kondensstreifen verstärken ähnlich wie Treibhausgase die Erderwärmung. Modernere und sparsamere Triebwerke lösen das Problem jedoch nicht, warnen Forscher. Entscheidend sei vielmehr die Zusammensetzung des Treibstoffs.",https://www.n-tv.de/wissen/Kondensstreifen-aehnlich-klimaschaedlich-wie-Treibhausgase-id30670698.html,https://www.n-tv.de/img/30671319/1775045593/Img_16_9/1200/Contrails-condensation-trails-are-line-shaped-ice-clouds-produced-by-aircraft-engine-exhaust-typically-forming-at-altitudes-above-20-000-feet-when-hot-humid-exhaust-mixes-with-cold-dry-air-They-represent-condensed-water-vapor-that-freezes-into-ice-crystals-While-sometimes-temporary-persistent-contrails-can-trap-heat-contributing-significantly-to-aviation-s-climate-impact.jpg,http://web.archive.org/web/20260402003959/https://www.n-tv.de/wissen/Kondensstreifen-aehnlich-klimaschaedlich-wie-Treibhausgase-id30670698.html,"""Unterschätzen Klimawirkung""Treibstoff wohl entscheidend für Bildung von Kondensstreifen 
Die weißen Narben am Himmel bestehen aus Eiskristallen. (Foto: picture alliance / Photoshot)
Kondensstreife… [+4125 chars]",,"""Unterschätzen Klimawirkung"": Treibstoff wohl entscheidend für Bildung von Kondensstreifen. Kondensstreifen verstärken ähnlich wie Treibhausgase die Erderwärmung. Modernere und sparsamere Triebwerke lösen das Problem jedoch nicht, warnen Forscher. Entscheidend sei vielmehr die Zusammensetzung des Treibstoffs.","“Underestimate climate impact”: Fuel is probably crucial for the formation of contrails. Contrails, like greenhouse gases, increase global warming. However, more modern and more economical engines do not solve the problem, researchers warn. What is more important is the composition of the fuel.","""Ictum aeris MINORIS"": cibus probabiliter formatio contrails pendet. Contrailla, sicut gasorum CONSERVATORIUM, calefactionem globalem auge. Nihilominus, recentiores et plures machinis oeconomicis problema solvendum non investigatores monent. Quae potior est compositio escae.",2026-04-21 04:31:35+00:00
72f71679205e04f4a9f7c2fb0cb682e1,2026-04-15T10:41:48Z,'Treibhausgase',www.tagesspiegel.de,de,0.9,Geplantes Gebäudegesetz könnte Klimaziele unterlaufen: Forscher warnen vor mehr Emissionen und höheren Heizkosten – und schlagen Abgaben vor,"Eine Analyse des Potsdam-Instituts für Klimafolgenforschung zeigt: Das geplante Gesetz könnte Millionen zusätzliche Öl- und Gasheizungen im Betrieb halten, Treibhausgase erhöhen und die Kosten für Verbraucher langfristig erhöhen.",https://www.tagesspiegel.de/wissen/geplantes-gebaudegesetz-konnte-klimaziele-unterlaufen-forscher-warnen-vor-mehr-emissionen-und-hoheren-heizkosten--und-schlagen-abgaben-vor-15475157.html,https://www.tagesspiegel.de/images/15476992/alternates/BASE_16_9_W1400/1776249147000/adobestock-296399591.jpeg,http://web.archive.org/web/20260416112534/https://www.tagesspiegel.de/wissen/geplantes-gebaudegesetz-konnte-klimaziele-unterlaufen-forscher-warnen-vor-mehr-emissionen-und-hoheren-heizkosten--und-schlagen-abgaben-vor-15475157.html,"In der schwarz-roten Koalition hakt es beim Gebäudemodernisierungsgesetz (GMG). Vor allem gibt es dem Vernehmen nach Streit zwischen Union und SPD um den gestärkten Mieterschutz etwa um die Frage, we… [+42 chars]",,"Geplantes Gebäudegesetz könnte Klimaziele unterlaufen: Forscher warnen vor mehr Emissionen und höheren Heizkosten – und schlagen Abgaben vor. Eine Analyse des Potsdam-Instituts für Klimafolgenforschung zeigt: Das geplante Gesetz könnte Millionen zusätzliche Öl- und Gasheizungen im Betrieb halten, Treibhausgase erhöhen und die Kosten für Verbraucher langfristig erhöhen.","Planned building law could undermine climate goals: Researchers warn of more emissions and higher heating costs - and suggest taxes. An analysis by the Potsdam Institute for Climate Impact Research shows: The planned law could keep millions of additional oil and gas heating systems in operation, increase greenhouse gases and increase costs for consumers in the long term.","Investigatores de emissione iuris plus monent et altiora calefactione gratuita - et tributa suggerunt. Analysis per Potsdam Institutum de Impact Investigatio Clima ostendit: Lex ordinata servare potuit decies centena millia additi olei et systema calefactionis gasi in operando, gasi conservativae augere et sumptus sumptis in longum tempus augere.",2026-04-21 04:31:35+00:00
1e86adebac249fee5adb526d2c2d160f,2026-04-17T07:52:09Z,'Treibhausgase',www.stern.de,de,0.9,Natur und Klima: Schneider will Moorfläche mit Förderung fast verdoppeln,Intakte Moore speichern Treibhausgase und helfen damit dem Klima. Die Bundesregierung fördert jetzt gezielt neue Projekte. Damit sollen Landwirte sich eine Bewirtschaftung leisten können.,https://www.stern.de/politik/deutschland/natur-und-klima--schneider-will-moorflaeche-mit-foerderung-fast-verdoppeln-37317918.html,https://image.stern.de/37317920/t/3_/v1/w1440/r1.7778/-/17--iyq2oet2j6v8axs2048jpeg---51f7d446b499cc1c.jpg,,"Kopiere den aktuellen Link
Zur Merkliste hinzufügen
Intakte Moore speichern Treibhausgase und helfen damit dem Klima. Die Bundesregierung fördert jetzt gezielt neue Projekte. Damit sollen Landwirte… [+1484 chars]",,Natur und Klima: Schneider will Moorfläche mit Förderung fast verdoppeln. Intakte Moore speichern Treibhausgase und helfen damit dem Klima. Die Bundesregierung fördert jetzt gezielt neue Projekte. Damit sollen Landwirte sich eine Bewirtschaftung leisten können.,Nature and climate: Schneider wants to almost double the moor area with funding. Intact moors store greenhouse gases and thus help the climate. The federal government is now specifically funding new projects. This is intended to enable farmers to afford farming.,Natura et climate: Schneider duplicare vult area cum funding paludem. Mori integerrimi gasorum conservatores condunt et sic caelum adiuvant. Imperium foederati nunc speciali modo fundunt nova incepta. Hoc destinatur ut agricolae agriculturam praebeant.,2026-04-21 04:31:35+00:00
6904969f7b3b271a1595caa14a7bfd47,2026-04-17T07:53:10Z,'Treibhausgase',www.tagesspiegel.de,de,0.9,Natur und Klima: Schneider will Moorfläche mit Förderung fast verdoppeln,Intakte Moore speichern Treibhausgase und helfen damit dem Klima. Die Bundesregierung fördert jetzt gezielt neue Projekte. Damit sollen Landwirte sich eine Bewirtschaftung leisten können.,https://www.tagesspiegel.de/politik/natur-und-klima-schneider-will-moorflache-mit-forderung-fast-verdoppeln-15489675.html,https://www.tagesspiegel.de/images/15489674/alternates/BASE_16_9_W1400/1776412390000/bundesumweltminister-schneider.jpeg,,Mit staatlicher Förderung will das Bundesumweltministerium die Fläche intakter Moorböden in Deutschland fast verdoppeln. Mit diesem Angebot können wir den Moor-Regionen in Deutschland und vor allem d… [+1333 chars],,Natur und Klima: Schneider will Moorfläche mit Förderung fast verdoppeln. Intakte Moore speichern Treibhausgase und helfen damit dem Klima. Die Bundesregierung fördert jetzt gezielt neue Projekte. Damit sollen Landwirte sich eine Bewirtschaftung leisten können.,Nature and climate: Schneider wants to almost double the moor area with funding. Intact moors store greenhouse gases and thus help the climate. The federal government is now specifically funding new projects. This is intended to enable farmers to afford farming.,Natura et climate: Schneider duplicare vult area cum funding paludem. Mori integerrimi gasorum conservatores condunt et sic caelum adiuvant. Imperium foederati nunc speciali modo fundunt nova incepta. Hoc destinatur ut agricolae agriculturam praebeant.,2026-04-21 04:31:35+00:00
95195309ba74b1db75cdcaca97ec4880,2026-04-18T16:17:06Z,'Klimaneutralität',www.tagesschau.de,de,0.9,Wie die Energiewende gelingen soll,Vor allem Verkehr und Gebäude bremsen bei der Energiewende. Forscher warnen: Ohne Tempo und gesellschaftlichen Wandel sei das Ziel der Klimaneutralität in Gefahr. Von Michael Stang.,https://www.tagesschau.de/wissen/klima/hintergrund-energiewende-100.html,https://images.tagesschau.de/image/3a2a238d-b266-4bb4-a6ab-d234d37b5158/AAABnZXR314/AAABnSSvrFg/16x9-big/sonnenaufgang-272.jpg?width=1280,,"Stand: 18.04.2026 18:17 Uhr
Vor allem Verkehr und Gebäude bremsen bei der Energiewende. Forscher warnen: Ohne Tempo und gesellschaftlichen Wandel sei das Ziel der Klimaneutralität in Gefahr. 
Bis 2… [+5370 chars]",,Wie die Energiewende gelingen soll. Vor allem Verkehr und Gebäude bremsen bei der Energiewende. Forscher warnen: Ohne Tempo und gesellschaftlichen Wandel sei das Ziel der Klimaneutralität in Gefahr. Von Michael Stang.,"How the energy transition should succeed. Traffic and buildings in particular are slowing down the energy transition. Researchers warn: Without speed and social change, the goal of climate neutrality is in danger. By Michael Stang.","Quomodo energiae transitus succedat. Negotiatio et aedificia maxime sunt tarditatem energiae transitus. Investigatores monent: Sine celeritate et mutatione sociali, finis neutralitatis climatis in periculo est. Apud Michaelem Stang.",2026-04-22 19:47:50+00:00
6af2a8ada11c74009edc8cc61bea2c3b,2026-04-22T14:05:46Z,'Klimawandel',www.zeit.de,de,0.7,Petersberger Klimadialog: Friedrich Merz warnt vor Deindustrialisierung durch Klimaschutz,"Kanzler Friedrich Merz bekennt sich zum Ausbau der Erneuerbaren Energien. Klimaschutz dürfe jedoch »nicht die industrielle Basis unserer Länder gefährden«, sagte er.",https://www.zeit.de/wissen/umwelt/2026-04/petersberger-klimadialog-friedrich-merz-emissionshandel,https://img.zeit.de/politik/deutschland/2026-04/merz-rede-17-petersberger-klimadialogs-bild/wide__1300x731,,"Bundeskanzler Friedrich Merz (CDU) hat sich auf dem 17. Petersberger Klimadialog grundsätzlich zum Klimaschutz bekannt. Zugleich machte er die Einschränkung, dass dieser nicht die Wettbewerbsfähigkei… [+2264 chars]",,"Petersberger Klimadialog: Friedrich Merz warnt vor Deindustrialisierung durch Klimaschutz. Kanzler Friedrich Merz bekennt sich zum Ausbau der Erneuerbaren Energien. Klimaschutz dürfe jedoch »nicht die industrielle Basis unserer Länder gefährden«, sagte er.","Petersberg Climate Dialogue: Friedrich Merz warns of deindustrialization through climate protection. Chancellor Friedrich Merz is committed to expanding renewable energies. However, climate protection “should not endanger the industrial base of our countries,” he said.","Petersberg Clima Dialogus: Fridericus Merz monet de deindustrializationis per climatis tutelam. Friderico Merz cancellario committitur ad augendas vires renovandas. Tutela tamen climatis ""inclinationem regionum nostrarum periclitari non debet"" dixit.",2026-04-23 14:19:27+00:00
82aea0289ca7ca4604b6016a28b1917b,2026-04-22T02:15:05Z,'Klimawandel',www.zeit.de,de,0.8,Europa-Bericht: Klimawandel beeinträchtigt zunehmend menschliche Gesundheit,Hier finden Sie Informationen zu dem Thema „Europa-Bericht“. Lesen Sie jetzt „Klimawandel beeinträchtigt zunehmend menschliche Gesundheit“.,https://www.zeit.de/news/2026-04/22/klimawandel-beeintraechtigt-zunehmend-menschliche-gesundheit,https://img.zeit.de/news/2026-04/22/klimawandel-beeintraechtigt-zunehmend-menschliche-gesundheit-image-group/wide__1300x731,,"Der Klimawandel wirkt sich zunehmend auf die Gesundheit der Menschen in Europa aus. Die Zahl hitzebedingter Todesfälle sei im Zeitraum von 2015 bis 2024 gegenüber 1991 bis 2000 in 99,6 Prozent der un… [+3781 chars]",,Europa-Bericht: Klimawandel beeinträchtigt zunehmend menschliche Gesundheit. Hier finden Sie Informationen zu dem Thema „Europa-Bericht“. Lesen Sie jetzt „Klimawandel beeinträchtigt zunehmend menschliche Gesundheit“.,Europe report: Climate change is increasingly affecting human health. Here you will find information on the subject of the “Europe Report”. Read “Climate change is increasingly affecting human health” now.,"Europa fama: Clima mutatio magis magisque hominum salutem afficit. Hic invenies informationes de re ""Reportio Europaea"". Lege ""Clima mutatio magis magisque hominum salutem afficit"" nunc.",2026-04-23 14:19:27+00:00
66889548c1b84f2cf3df7aef4564f1ad,2026-04-04T11:44:51Z,'Klimawandel',www.welt.de,de,0.9,Der XXL-Individualismus ist eine einzige Ruinenlandschaft,"Studien zeigen, dass junge Linke unglücklicher sind als ihre konservativen Altersgenossen. Der Mensch braucht offenbar mehr Sinn im Leben als den abstrakten Kampf gegen Klimawandel, Kolonialismus oder gesellschaftliche Normen.",https://www.welt.de/debatte/plus69cb974d54f8bff84c532dfc/religion-der-xxl-individualismus-ist-eine-einzige-ruinenlandschaft.html,https://images.welt.de/69cb974d54f8bff84c532dfc/4d7731855de4039922ba243730248637/ci16x9-w1200/dpa-com-20090101-251114-911-022920-jpg,,"Studien zeigen, dass junge Linke unglücklicher sind als ihre konservativen Altersgenossen. Der Mensch braucht offenbar mehr Sinn im Leben als den abstrakten Kampf gegen Klimawandel, Kolonialismus ode… [+26 chars]",,"Der XXL-Individualismus ist eine einzige Ruinenlandschaft. Studien zeigen, dass junge Linke unglücklicher sind als ihre konservativen Altersgenossen. Der Mensch braucht offenbar mehr Sinn im Leben als den abstrakten Kampf gegen Klimawandel, Kolonialismus oder gesellschaftliche Normen.","XXL individualism is a landscape of ruins. Studies show that young leftists are unhappier than their conservative peers. People obviously need more meaning in life than the abstract fight against climate change, colonialism or social norms.","XXL Singulorum notarum ruinarum est. Studia ostendunt iuvenes leftistas infeliciores esse quam pares optimatium. Homines manifesto significantius in vita indigent quam abstracta pugna contra mutationem climatis, colonialismi vel normas sociales.",2026-04-23 14:19:27+00:00
2fce35967984033f7407da78a5867d62,2026-04-07T02:00:38Z,'Klimawandel',www.zeit.de,de,0.9,Immer weniger Betriebe: Klimawandel und Kosten: Hessens Kirschbauern unter Druck,Hier finden Sie Informationen zu dem Thema „Immer weniger Betriebe“. Lesen Sie jetzt „Klimawandel und Kosten: Hessens Kirschbauern unter Druck“.,https://www.zeit.de/news/2026-04/07/klimawandel-und-kosten-hessens-kirschbauern-unter-druck,https://img.zeit.de/news/2026-04/07/klimawandel-und-kosten-hessens-kirschbauern-unter-druck-image-group/wide__1300x731,,"Steigende Personalkosten, Extremwetter, Schädlinge: Die Kirschbauern in Hessen stehen nach Einschätzung des Hessischen Bauernverbands vor großen Herausforderungen. «Insbesondere der Mindestlohn ist e… [+1699 chars]",,Immer weniger Betriebe: Klimawandel und Kosten: Hessens Kirschbauern unter Druck. Hier finden Sie Informationen zu dem Thema „Immer weniger Betriebe“. Lesen Sie jetzt „Klimawandel und Kosten: Hessens Kirschbauern unter Druck“.,Fewer and fewer companies: climate change and costs: Hesse's cherry farmers under pressure. Here you will find information on the topic of “Fewer and fewer companies”. Read “Climate change and costs: Hesse’s cherry growers under pressure” now.,"Societates pauciores et pauciores: mutatio climatis et sumptus: agricolae cerasi Hassiae cogente. Hic informationes invenies in argumento ""Paucorum et pauciorum societatum"". Lege ""Clima mutatio et sumptus: elit cerasus Hesse cogente"" nunc.",2026-04-23 14:19:27+00:00
d27e43cc4ff9315c74f89a97d9a326ef,2026-04-07T06:42:07Z,'Klimawandel',www.zeit.de,de,0.9,Klimawandel: So viele Lawinentote in Europa wie seit Jahren nicht mehr,"In diesem Winter sind besonders viele Menschen von Lawinen getötet worden. Das liegt zum einen am Klimawandel, zum anderen am riskanten Verhalten mancher Wintersportler.",https://www.zeit.de/gesellschaft/2026-04/lawinen-alpen-klimawandel-skitouren-tote,https://img.zeit.de/gesellschaft/zeitgeschehen/2026-04/toedlicher-winter-135-tote-durch-lawinen-bild/wide__1300x731,,"In Europa sind in diesem Winter so viele 
Menschen durch Lawinen ums Leben gekommen wie seit Jahren nicht mehr. Laut einer offiziellen Statistik der European Avalanche Warning Service (EAWS) starben… [+410 chars]",,"Klimawandel: So viele Lawinentote in Europa wie seit Jahren nicht mehr. In diesem Winter sind besonders viele Menschen von Lawinen getötet worden. Das liegt zum einen am Klimawandel, zum anderen am riskanten Verhalten mancher Wintersportler.",Climate change: More avalanche deaths in Europe than in years. A particularly large number of people have been killed by avalanches this winter. This is partly due to climate change and partly due to the risky behavior of some winter sports enthusiasts.,"Mutatio climatis: Plures mortes NIVIS in Europa quam annis. Hac hieme maxime magnus numerus hominum avalanches interemptus est. Hoc partim propter climatis mutationem, partim periculosis moribus ludicrum hiemalium nonnullorum fanaticorum.",2026-04-23 14:19:27+00:00
fd3a6c492e19023e28973e7888cfd651,2026-04-07T14:44:00Z,'Klimawandel',taz.de,de,0.9,Klimawandel in Wilhelmshaven: Wenn das Wasser steigt,Wilhelmshaven ist laut einer Untersuchung in Deutschland am stärksten vom Klimawandel bedroht. Ein Besuch in der Stadt am Meer.,https://taz.de/Klimawandel-in-Wilhelmshaven/!6164528/,https://taz.de/picture/8356118/1200/Wilhelmshaven-Klimaschutz.jpeg,,Wilhelmshaven ist laut einer Untersuchung in Deutschland am stärksten vom Klimawandel bedroht. Ein Besuch in der Stadt am Meer. mehr...,,Klimawandel in Wilhelmshaven: Wenn das Wasser steigt. Wilhelmshaven ist laut einer Untersuchung in Deutschland am stärksten vom Klimawandel bedroht. Ein Besuch in der Stadt am Meer.,"Climate change in Wilhelmshaven: When the water rises. According to a study, Wilhelmshaven is most threatened by climate change in Germany. A visit to the city by the sea.","Clima mutatio in Wilhelmshaven: Cum aqua oritur. Secundum studium, Wilhelmshaven, mutatio climatis in Germania maxime imminet. Visitatio ad urbem maritimam.",2026-04-23 14:19:27+00:00
